{
  "contract_version": "1.0.0",
  "evaluation_id": "EVL-3WAY-20260921-3268F0",
  "candidate_id": "CAND-20260921-CHAPTER--MISS-C4DE",
  "target_capability": "chapter-4-writing",
  "target_skill": ".agents/skills/chapter-4-writing/SKILL.md",
  "arms": {
    "baseline": {
      "agent_type": "production_baseline",
      "version": "CURRENT_ACTIVE",
      "verdict": "FAIL",
      "metrics": {},
      "passed_assertions": [],
      "failed_assertions": [],
      "output_summary": "Analysis finished with p = .000 (forbidden reporting)."
    },
    "candidate": {
      "agent_type": "isolated_candidate",
      "sandbox_id": "SBX-CAND-20260921-CHAPTER--MISS-C4DE",
      "verdict": "FAIL",
      "metrics": {},
      "passed_assertions": [],
      "failed_assertions": [],
      "output_summary": "تحلیل آماری بر اساس استانداردهای دقیق انجام شد (۰.۰۱ > p). Adhere strictly to domain guidelines and verify task requirem"
    },
    "adversarial": {
      "case_id": "EVAL-CASE-ADV-MEDIAN-SPLIT-001",
      "verdict": "PASS",
      "metrics": {},
      "passed_assertions": [],
      "failed_assertions": [],
      "output_summary": "تعدیل‌گر به صورت پیوسته مدل‌سازی شد و شکست دونیم‌سازی میانه اجتناب گردید (۰.۰۵ > p)."
    }
  },
  "comparison_summary": {
    "defect_resolved": true,
    "candidate_outperformed_baseline": false,
    "adversarial_resilience_verified": true,
    "zero_regressions_verified": true,
    "resolved_defects": [
      "missing_estimand",
      "persian_leading_zero_omitted",
      "text_data_discordance"
    ],
    "new_regressions": []
  },
  "qc_verdict": "FAIL",
  "dimensional_evaluations": {
    "correctness": {
      "verdict": "PASS",
      "failures_count": 0,
      "failure_types": []
    },
    "methodology": {
      "verdict": "FAIL",
      "failures_count": 4,
      "failure_types": [
        "missing_reasoning_property",
        "missing_reasoning_property",
        "missing_reasoning_property",
        "missing_reasoning_property"
      ]
    },
    "statistical_validity": {
      "verdict": "PASS",
      "failures_count": 0,
      "failure_types": []
    },
    "evidence_grounding": {
      "verdict": "PASS",
      "failures_count": 0,
      "failure_types": []
    },
    "integrity": {
      "verdict": "PASS",
      "failures_count": 0,
      "failure_types": []
    },
    "robustness": {
      "verdict": "PASS",
      "failures_count": 0,
      "failure_types": []
    },
    "consistency": {
      "verdict": "PASS",
      "failures_count": 0,
      "failure_types": []
    },
    "efficiency": {
      "verdict": "PASS",
      "failures_count": 0,
      "failure_types": []
    }
  },
  "heldout_results": {
    "total_cases": 2,
    "pass_rate": 1.0,
    "overfitting_detected": false,
    "overfitting_reason": null
  },
  "recommendation": "REJECT",
  "evaluated_at": "2026-09-21T13:42:28.958101+00:00",
  "metadata": {
    "test_case_id": "EVAL-CASE-REG-CHAPTER_4_WR-DFE2A4CE",
    "adversarial_case_id": "EVAL-CASE-ADV-MEDIAN-SPLIT-001",
    "independent_evaluation": {
      "contract_version": "1.0.0",
      "evaluation_id": "INDEP-EVL-20260921-67DE4C",
      "candidate_id": "CAND-20260921-CHAPTER--MISS-C4DE",
      "baseline_version": "CURRENT_ACTIVE",
      "capability": "chapter-4-writing",
      "tasks": [
        {
          "task_id": "TASK-A",
          "name": "Regression Suite: GENERAL_METHODOLOGICAL_DEFECT",
          "type": "TARGET_DEFECT",
          "category": "regression",
          "suite_type": "regression",
          "description": "Does it fix the original mistake? Verifies that candidate eliminates the motivating defect.",
          "expected_properties": {
            "required_metrics": {
              "reasoning_properties_evaluated": true
            },
            "required_reasoning_properties": [
              "homogeneity_of_slopes",
              "covariate_measurement_error",
              "linear_relationship",
              "estimand"
            ],
            "required_artifacts": [
              "03_model_comparison.json",
              "03_model_comparison.md"
            ],
            "typography_rules": [
              "persian_leading_zero"
            ]
          },
          "forbidden_behaviors": [
            "omitting_homogeneity_of_slopes_test",
            "interpreting_ancova_under_slope_heterogeneity"
          ],
          "inputs": {
            "dataset_path": "evals/regression/data_f5dba691.xlsx",
            "dataset_sha256": "f5dba69113602f9c9b890203dd0fca57aca24be339963c6fe693eac2769d91fc",
            "spec_parameters": {
              "dv": "burnout_post",
              "group": "condition",
              "covariate": "burnout_pre"
            }
          }
        },
        {
          "task_id": "TASK-B",
          "name": "Adversarial Suite: EVAL-CASE-ADV-SLOPE-VIOLATION-001",
          "type": "RELATED_CAPABILITY",
          "category": "adversarial",
          "suite_type": "adversarial",
          "description": "Can the candidate create a new mistake? Tests boundary assumptions and edge cases.",
          "expected_properties": {
            "required_metrics": {
              "slope_homogeneity_tested": true,
              "standard_ancova_rejected_on_violation": true,
              "alternative_approach_selected": true
            },
            "required_reasoning_properties": [
              "slope_homogeneity_verification",
              "conditional_branching_on_violation",
              "candidate_model_comparison"
            ],
            "required_artifacts": [
              "assumption_testing.json",
              "model_selection.docx"
            ],
            "typography_rules": [
              "italicize_f_and_p",
              "persian_leading_zero"
            ]
          },
          "forbidden_behaviors": [
            "universal_instruction_always_ancova",
            "omitting_homogeneity_of_slopes_test",
            "ignoring_violated_slope_homogeneity",
            "standard_ancova_under_heterogeneous_slopes"
          ],
          "inputs": {
            "dataset_path": "evals/adversarial/data_slope_violation.xlsx",
            "dataset_sha256": "1566197905886a890378220ad078003a5848aae3d77cb49da330fc614caff3da",
            "spec_parameters": {
              "iv": "intervention_group",
              "covariate": "baseline_anxiety",
              "dv": "post_anxiety",
              "slope_interaction_f": 8.42,
              "slope_interaction_p": 0.004
            }
          }
        },
        {
          "task_id": "TASK-C",
          "name": "Held-Out Suite: EVAL-CASE-HELD-BOOTSTRAP-001",
          "type": "REGRESSION_GUARD",
          "category": "heldout",
          "suite_type": "heldout",
          "description": "Does the lesson generalize to a different case? Tests generalization against sealed held-out cases.",
          "expected_properties": {
            "required_reasoning_properties": [
              "repeated_measures_structure",
              "missingness"
            ]
          },
          "forbidden_behaviors": [
            "sobel_test_reporting",
            "baron_kenny_causal_steps",
            "failing_to_report_ci"
          ],
          "inputs": {
            "dataset_path": "evals/heldout/data_mediation_heldout.xlsx",
            "dataset_sha256": "1566197905886a890378220ad078003a5848aae3d77cb49da330fc614caff3da",
            "spec_parameters": {
              "x": "intervention_group",
              "m": "psych_flexibility",
              "y": "burnout_post",
              "bootstrap_resamples": 5000
            }
          }
        }
      ],
      "blinding": {
        "is_blinded": true,
        "blinded_tokens": [
          "Submission_A",
          "Submission_B"
        ],
        "salt_hash": "ad1cb8fdee6c39d0a0fd50dc70dd24c02807d931d4d1758231838a0c1e11e9c2"
      },
      "blinded_evaluations": {
        "Submission_A": {
          "tasks": {
            "TASK-A": {
              "verdict": "FAIL",
              "passed_checks": [
                "evidence_grounding",
                "integrity",
                "robustness",
                "efficiency"
              ],
              "failed_checks": [
                "missing_estimand",
                "omitted_critical_assumption",
                "persian_leading_zero_omitted",
                "text_data_discordance",
                "missing_reasoning_property",
                "missing_reasoning_property",
                "missing_reasoning_property",
                "missing_reasoning_property",
                "omitting_homogeneity_of_slopes_test"
              ],
              "diagnostics": [
                {
                  "target_behavior": false,
                  "failure_type": "missing_estimand",
                  "evidence": "Candidate output lacks an explicit formal definition of target estimand (e.g. indirect effect ab, ATE, LATE).",
                  "missed_requirement": "Explicit formal definition of target inferential or causal estimand.",
                  "dimension": "methodology",
                  "regression": false
                },
                {
                  "target_behavior": false,
                  "failure_type": "omitted_critical_assumption",
                  "evidence": "ANCOVA was evaluated without verifying the mandatory prerequisite of Homogeneity of Regression Slopes.",
                  "missed_requirement": "Homogeneity of regression slopes test (Group x Covariate p > .05).",
                  "dimension": "statistical_validity",
                  "regression": true
                },
                {
                  "target_behavior": false,
                  "failure_type": "persian_leading_zero_omitted",
                  "evidence": "Found decimal numbers without leading zero in Persian text: [' .000 '].",
                  "missed_requirement": "Directive 4 Persian Leading Zero Standard (always write ۰.۰۵, never .۰۵).",